ID,Job Title,Description,Responsibilities,Basic Qualifications,Preferred Qualifications
126,Senior Data Engineer - Telecommute,"Careers at Rally Health, part of the Optum and UnitedHealth Group family of businesses. Our mission at Rally® is to empower individuals to take control of their health through personalized, data-driven health care information and recommendations that lead to better outcomes. We leverage our digital platform and leading-edge technology to make health care data accessible wherever and whenever people need it, all while ensuring safety and reliability. Here, you’ll help people find the right doctors, give them a clear breakdown of costs, incentivize them to stay focused on their overall health with daily goals, and help them earn rewards such as discounts on a wide range of goods as well as bonuses for reaching fitness objectives. As part of our Rally® team, you’ll have the opportunity to drive change with an innovative healthcare technology company that is dedicated to creating a culture of healthy living. Help us bring real change to healthcare and you’ll experience what it’s like to do your life's best work.(sm)

Join Rally Health as a Senior or Principal Data Engineer where you will partner with product managers and data consumers to meet our internal analytics and client data needs. You will use our modern data platform - which uses infrastructure and tools like Kafka, MongoDB, Postgres, Spark, Databricks, Airflow, Amazon S3, and Amazon Redshift. You will oversee the entire lifecycle of data pipeline development from data discovery and design to quality and maintenance. As part of the larger Data Engineering team, you will report to an Engineering Manager. We recognize that people come from a diverse set of backgrounds and skills and we welcome all to apply.
","Oversee the end-to-end discovery, design, development, and QA of big data pipelines.
Architect and code solutions for large-scale ETL pipelines with data processing frameworks
Develop data solutions to promote applicable insights for population health management and positive recommendations for ways individuals can improve their health and manage their costs
Assess current processes, recommend, and implement approaches to handle increasing volumes of data
Communicate technical specifications to ensure that proper and optimized techniques, queries, data standards, and final outputs are understood and incorporated into data and analytics processes
Participate in business analysis activities to gather required reporting and dashboard requirements
Handle the product's or project's conception, translate requirements, design initial technical specifications and develop data solutions","BS in Computer Science, Engineering or a related technical role or equivalent experience
5+ years experience in ETL, Data Engineering, or Business Intelligence fields with concentration on data transformations
Experience working in object-oriented or functional languages like Python, Scala or Java
Experience with backend and distributed systems
Experience designing data models with Kimball, OLAP, and other EDW methodologies
Experience with Airflow or another workflow orchestration framework (ex. Oozie, Prefect, DAGster)
Understanding of several data extraction and transformation techniques with data sourced in S3, MongoDB, and Postgres
Advanced working knowledge of complex Spark jobs and SQL queries","Experience with data visualization or BI tools
Experience with Scala"
127,Principal Data Engineering,"We’re creating opportunities in every corner of the health care marketplace to improve lives while we’re building careers. And that means continuous career growth opportunities for you. While we support you with the latest tools, advanced training, and the combined strength of high-caliber co-workers, you can continue following the path of your life’s best work. (sm)

Combine two of the fastest-growing fields on the planet with a culture of performance, collaboration, and opportunity, and this is what you get. Leading-edge technology in an industry that’s improving the lives of millions. Here, innovation isn’t about another gadget; it’s about making health care data available wherever and whenever people need it, safely and reliably. There’s no room for error. Join us and start doing your life’s best work. (sm)

As Principal Data Engineer, you will play the lead technical developer role in leading the business/contractual requirements, data, and ETL/reporting design, development, implementation, operations/maintenance. This position will also support data/ETL architecture, assure data quality/integrity for analytics/business intelligence reports. You’ll have the opportunity to work in complex ETL/data development tasks and support a talented team of analysts, developers, testers, and admins. This position will report to the project manager or their designee to help our business and teams co-create innovative solutions for our customers.

You’ll enjoy the flexibility to telecommute* from anywhere within the U.S. as you take on some tough challenges.","Developing ETL solutions and supporting data strategy leveraging acquired subject matter expertise to identify/inform opportunities/risks.
Developing/leading complex dashboards, scorecards, reports, data analysis
Performing peer-reviews and providing expert technical support/guidance to the project team
Leading creating/maintaining database, ETL, reporting architecture/environment, processes/procedures, coding standards, and data management/security activities
Supporting/Standing up the enterprise data environment for disaster situations or annual disaster recovery drill
Supporting the project manager and leadership in project planning and executing activities, including presentations, risks/issues, and status reporting
Demonstrating deliverables to the team or the customers for approvals and gain buy-in to implement solutions or adapt to new products/services/programs
Working with the vendors, DBAs, data modelers, and application/system admins to support maintaining the Teradata and application server hardware and software (including patches, fixes, and upgrades) and leading industry level standards or best practices.","Bachelors or Advanced Degree in a related field such as Information Technology/Computer Science, Mathematics/Statistics, Analytics, Business Technology
7+ years of ETL and enterprise data warehouse technical development
7+ years of experience gathering requirements, exploring data, SQL/DB development
7+ years of experience in reporting, analysis, and/or data management/governance
4+ years of Informatica PowerCenter
4+ years of experience leading a team as a technical lead or similar capacity
Demonstrated experience working with, and leading, high-performing remote teams and delivering to external customer
Advanced skills in Microsoft Office (Excel, Word, PowerPoint, etc.) with strong communication skills
If you need to enter a work site for any reason, you will be required to screen for symptoms using the ProtectWell mobile app, Interactive Voice Response (i.e., entering your symptoms via phone system) or similar UnitedHealth Group-approved symptom screener. When in a UnitedHealth Group building, employees are required to wear a mask in common areas. In addition, employees must comply with any state and local masking orders","MBA or advanced degree
Experience in Medicaid/Managed Care/health insurance industry
Experience with visualization tools (Power B.I., Tableau, SAS, etc.)
Experience using Snowflake
Experience in scripting language experience (Python, R, SAS, T-SQL, etc.)
Familiarity with A.I. and machine learning"
128,"Sr. Data Engineer - Eden Prairie, MN","Combine two of the fastest-growing fields on the planet with a culture of performance, collaboration and opportunity and this is what you get. Leading edge technology in an industry that is improving the lives of millions. Here, innovation is not about another gadget; it is about making health care data available wherever and whenever people need it, safely and reliably. There is no room for error. If you are looking for a better place to use your passion and your desire to drive change, this is the place to be. It's an opportunity to do your life's best work.(sm)

You’ll enjoy the flexibility to telecommute* from anywhere within United States as you take on some tough challenges.","Full development cycle of a Data Warehouse, including requirements gathering, design, implementation and maintenance
Gather and analyze business requirements
Develop technical specifications and design documents
Architect and design Data Warehouse infrastructure and solutions
Develop Test Strategy, Test Plans, Test scenarios, and Test scripts. Create Test Strategy / Test Data Requirements.
Test Data Warehouses/Data Marts
Deploy and maintain Data Warehouses/Data Marts
Write SQL statements to profile and analyze data
Work concurrently on several projects, each with specific instructions that may differ from project to project
Ensure that quality processes are carried out through all phases of the Software Development Lifecycle
Design and implement efficient and effective functional design solutions
Work closely with the Business and Developers to ensure requirements are met
Understanding of all phases of the Software Development Life Cycle, and using Agile Methodology and Tools
Respond to customer inquiries and production issues
Document, discuss and resolve business, data and reporting issues within the team, across functional teams, and with business stakeholders
Partner with Business during User Acceptance Testing , assist business users in defining User Acceptance Testing, test cases and plans. Actively participate in user group meetings to review use cases and review Test Results prior to UAT start
Present written and verbal data analysis findings, to both the project team and business stakeholders
Monitor activities associated with responsible domains - job monitoring, issue identification, documentation, analysis and resolution
Continually look for ways to eliminate/reduce, streamline, and automate","5+ years of Data Analysis experience
5+ years of relational database experience
5+ years of complex SQL script writing experience
5+ years of experience testing
3+ years of experience with Agile/Scrum project management methodology and Agile tools (e.g. Rally or Jira)
Full COVID-19 vaccination is an essential requirement of this role. UnitedHealth Group will adhere to all federal, state and local regulations as well as all client requirements and will obtain necessary proof of vaccination prior to employment to ensure compliance","5+ years of Healthcare Data Analysis experience
5+ years of SQL or Teradata experience
3+ years of UNIX /Perl scripting experiences
3+ years of experience with ETL tool
3+ years working on large data warehouse/big data projects
Healthcare Industry experience
Experience in an onshore/offshore model environment
Experience with Teradata
Experience with Data stage ETL tool
Experience with Enterprise scheduling tools
CA Agile Rally
Operations/production support
Excellent oral and written communication skills"
129,Principal Data Engineering - Telecommute,"We’re creating opportunities in every corner of the health care marketplace to improve lives while we’re building careers. And that means continuous career growth opportunities for you. While we support you with the latest tools, advanced training, and the combined strength of high-caliber co-workers, you can continue following the path of your life’s best work. (sm)

 

Combine two of the fastest-growing fields on the planet with a culture of performance, collaboration, and opportunity, and this is what you get. Leading-edge technology in an industry that’s improving the lives of millions. Here, innovation isn’t about another gadget; it’s about making health care data available wherever and whenever people need it, safely and reliably. There’s no room for error. Join us and start doing your life’s best work. (sm)

 

As Principal Data Engineer, you will play the lead technical developer role in leading the business/contractual requirements, data, and ETL/reporting design, development, implementation, operations/maintenance. This position will also support data/ETL architecture, assure data quality/integrity for analytics/business intelligence reports. You’ll have the opportunity to work in complex ETL/data development tasks and support a talented team of analysts, developers, testers, and admins. This position will report to the project manager or their designee to help our business and teams co-create innovative solutions for our customers. ","Developing ETL solutions and supporting data strategy leveraging acquired subject matter expertise to identify/inform opportunities/risks.
Developing/leading complex dashboards, scorecards, reports, data analysis
Performing peer-reviews and providing expert technical support/guidance to the project team
Leading creating/maintaining database, ETL, reporting architecture/environment, processes/procedures, coding standards, and data management/security activities
Supporting/Standing up the enterprise data environment for disaster situations or annual disaster recovery drill
Supporting the project manager and leadership in project planning and executing activities, including presentations, risks/issues, and status reporting
Demonstrating deliverables to the team or the customers for approvals and gain buy-in to implement solutions or adapt to new products/services/programs
Working with the vendors, DBAs, data modelers, and application/system admins to support maintaining the Teradata and application server hardware and software (including patches, fixes, and upgrades) and leading industry level standards or best practices.","Bachelors or Advanced Degree in a related field such as Information Technology/Computer Science, Mathematics/Statistics, Analytics, Business Technology
7+ years of ETL/Informatica and enterprise data warehouse technical development
7+ years of experience gathering requirements, exploring data, SQL/DB development
7+ years of experience in reporting, analysis, and/or data management/governance
4+ years of experience leading a team as a technical lead or similar capacity
Demonstrated experience working with, and leading, high-performing remote teams and delivering to external customer
Advanced skills in Microsoft Office (Excel, Word, PowerPoint, etc.) with strong communication skills
If you need to enter a work site for any reason, you will be required to screen for symptoms using the ProtectWell mobile app, Interactive Voice Response (i.e., entering your symptoms via phone system) or similar UnitedHealth Group-approved symptom screener. When in a UnitedHealth Group building, employees are required to wear a mask in common areas. In addition, employees must comply with any state and local masking orders","MBA or advanced degree
Experience in Medicaid/Managed Care/health insurance industry
Experience with visualization tools (Power B.I., Tableau, SAS, etc.)
Experience using Snowflake
Experience in scripting language experience (Python, R, SAS, T-SQL, etc.)
Familiarity with A.I. and machine learning"
130,Senior Manager Data Engineer - Telecommute,"Combine two of the fastest-growing fields on the planet with a culture of performance, collaboration and opportunity and this is what you get. Leading edge technology in an industry that is improving the lives of millions. Here, innovation is not about another gadget; it is about making health care data available wherever and whenever people need it, safely and reliably. There is no room for error. If you are looking for a better place to use your passion and your desire to drive change, this is the place to be. It's an opportunity to do your life's best work.(sm)

You’ll enjoy the flexibility to telecommute* from anywhere within United States as you take on some tough challenges.","Partner with Business, Technical and Strategic Product to manage project commitments in an agile framework; rapidly delivering value to our customers via technology solutions
Own the applications’ technology stack and drive modern solutions to complex problems
Execute with excellence, hitting key metrics and MBOs, understanding they are meaningful indicators
Drive design and development of resilient, reliable, scalable and self-healing solutions to meet and exceed customer requirements
Ensure that all parts of the application eco system are thoroughly and effectively covered with telemetry
Relieve the team of “churn” and “waste” by driving automation of menial tasks
Build trust with business and tech stakeholders by delivering with solutions aligned with expectations, of high quality, on-time, and with measurable value
Communicate clearly and effectively in oral and written forms, and be able to present and demonstrate work to technical and non-technical stakeholders
Manage forecasts and budgets from multiple funding sources for engineering team demand
Recruit and retain teams of highly capable data engineers, driving career development and owning standard resource manager responsibilities
Mentor the engineering team to develop and perform as highly as possible","Undergraduate degree or equivalent experience
5+ years of solid understanding of software engineering and processes: design patterns, algorithms, data structures, schemas and queries, system design, unit testing, code reviews, agile, and dev-ops
5+ years of experience with languages such as Java, C#, Python, Scala, Kotlin, as an engineer
3+ years of experience working with teams that leveraged two or more of the following: continuous integration / continuous delivery tools, REST API development, serverless architecture, containerization, IaC, public / private cloud, data pipelines, application observability and monitoring, site reliability engineering
1+ years of IT leadership experience
2+ years of deep agile development experience; strong understanding of DevOps mindset
2+ years of deep understanding of industry patterns for application architecture and integration
2+ years of production operational support","2+ years of managing others, or commensurate tech lead experience
1+ year of Production experience with cloud technologies"
131,Senior Data Engineer - Telecommute,"Combine two of the fastest-growing fields on the planet with a culture of performance, collaboration and opportunity and this is what you get. Leading edge technology in an industry that's improving the lives of millions. Here, innovation isn't about another gadget, it's about making health care data available wherever and whenever people need it, safely and reliably. There's no room for error. Join us and start doing your life's best work.(sm)

Functions may include database architecture, engineering, design, optimization, security, and administration; as well as data modeling, big data development, Extract, Transform, and Load (ETL) development, storage engineering, data warehousing, data provisioning and other similar roles. Responsibilities may include Platform-as-a-Service and Cloud solution with a focus on data stores and associated eco systems. Duties may include management of design services, providing sizing and configuration assistance, ensuring strict data quality, and performing needs assessments. Analyzes current business practices, processes and procedures as well as identifying future business opportunities for leveraging data storage and retrieval system capabilities. Manages relationships with software and hardware vendors to understand the potential architectural impact of different vendor strategies and data acquisition. Data engineer may design schemas, write SQL or other data markup scripting, and helps to support development of Analytics and Applications that build on top of data. Selects, develops and evaluates personnel to ensure the efficient operation of the function.","Large complex components; influencing overall product architecture and patterns
Autonomously Implementing component design in line with pre-defined modern team architectural patterns
Partner with Business, Technical and Strategic Product to manage project commitments in an agile framework; rapidly delivering value to our customers via technology solutions
Design and develop resilient, reliable, scalable and self-healing solutions to meet and exceed customer requirements
Ensure that all parts of the application eco-system are thoroughly and effectively covered with telemetry
Relieve the team of “churn” and “waste” by introducing automation of menial tasks
Collaborate with engineers on partner-teams to build cohesive and optimal solutions
Communicate clearly and effectively in oral and written forms, and be able to present and demonstrate work to technical and non-technical stakeholders
Mentor more junior members of the engineering team to develop and perform as highly as possible","Undergraduate degree or equivalent experience
3+ years of IT experience in Software Engineering
2+ years of experience working on large scale, multiple team projects
2+ years of experience with Agile methodologies and Test-Driven Development
2+ years of experience with at least 1 scripting language such as Perl, Python or PowerShell, JavaScript
1+ years of experience with programmatic interaction with DBMA and NoSQL database like MongoDB
1+ years of cloud experience, preferably Azure","Cloud development and computing
Cutting edge technology (AI, ML, Blockchain, Wearables, IOT)
Continuous integration experience/DevOps skills, (Typescript, Jenkins, Git, NodeJS)
Microservice design, Java Spring, Kafka, RabbitMQ"
132,"Senior Data Engineer - Phoenix, AZ or Telecommute","UnitedHealthcare is a company that's on the rise. We're expanding in multiple directions, across borders and, most of all, in the way we think. Here, innovation isn't about another gadget, it's about transforming the health care industry. Ready to make a difference? Make yourself at home with us and start doing your life's best work.(sm)

Data Science, Engineering, and Big Data are helping reinvent the healthcare system, helping people live heathier lives and making the healthcare system work better for everyone.

The Business Analytics Sciences Insights & Strategies (BASIS) organization of UnitedHealthcare delivers analytic services and solutions which support all aspects of UHC Medicaid and Medicare operations from finance, identification of fraud/waste/abuse, improved member/provider experience, clinical intelligence, and more! You will be responsible for providing innovative technical ideas to solve complex healthcare business problems. You will work with Business and Technical leaders, Project Managers, and architects across multiple lines of businesses to drive and implement solutions using a variety of tools and technologies.","Work with healthcare business stakeholders to identify key business problems, then diagnose, analyze and synthesize advanced data engineering solutions
Conduct cost/benefit analysis for projects and product delivery
Architect/design data warehouse infrastructure solutions to support enterprise-wide data science needs
Work with the business teams to operationalize analytics solutions for problems in areas of Provider Operations, Claims Operations, Finance, and Quality
Manage, guide, train, and assist team members with technical issues and designs.
Create complex data extracts from large Data Warehouse and Big Data environments.
Develop, enhance and integrate Data Warehouse, Big Data, and Business Intelligence solutions.
Demonstrate excellent analytical and problem-solving skills, including the ability to identify root causes and recommend solutions","BA/BS degree
5+ years of Data warehouse development and design
Advanced experience with PL/SQL development
Advanced experience with Unix Shell Scripting
Advanced experience with ETL tools such as Spark, Informatica, or Talend
Experience with mid-high volume ETL processing
Solid Data Analysis skills
Experience with formal System Development Lifecycle and Data Quality processes
Proven leadership experience in building and managing a technology portfolio
Experience and ability to work well under pressure in a fast-paced environment","Healthcare domain experience
Experience with Kafka data streaming
Experience with Hadoop stack (MapReduce, Sqoop, Pig, Hive, Flume)
Experience with statistical software (SAS, Python, etc.)
Familiarity with Agile methodology"
